{
  "kb_id": "energy_metering_cosem_classes",
  "name": "COSEM Interface Classes Seed Knowledge Base",
  "version": "0.1.0",
  "layer": "cosem_class_attribute_method",
  "description": "Third-layer seed knowledge base for COSEM interface classes, attributes, methods, and common object instances used in energy metering documents.",
  "entries": [
    {
      "id": "KB-L3-IC-1-DATA",
      "type": "cosem_interface_class",
      "layer": "cosem_class",
      "name": "Data",
      "aliases": ["COSEM Data", "class 1", "CL 1"],
      "keywords": ["class 1", "cl 1", "data object", "cosem logical device name", "device id", "security-invocation counter"],
      "domain_tags": ["cosem_class", "cosem_object", "data_model"],
      "definition": "Generic COSEM interface class for a single data value.",
      "class_id": 1,
      "attributes": [
        {"attribute_id": 1, "name": "logical_name", "type": "octet-string[6]", "mandatory": true, "meaning": "OBIS logical name of the object"},
        {"attribute_id": 2, "name": "value", "type": "any", "mandatory": true, "meaning": "Stored data value"}
      ],
      "methods": [],
      "common_instances": [
        {"name": "COSEM logical device name", "obis": "0-0:42.0.0.255"},
        {"name": "Device ID 1", "obis": "0-0:96.1.0.255"},
        {"name": "Device ID 5", "obis": "0-0:96.1.4.255"},
        {"name": "Security-Invocation counter", "obis_pattern": "0-0:43.1.x.255"}
      ]
    },
    {
      "id": "KB-L3-IC-3-REGISTER",
      "type": "cosem_interface_class",
      "layer": "cosem_class",
      "name": "Register",
      "aliases": ["COSEM Register", "class 3", "CL 3"],
      "keywords": ["class 3", "cl 3", "register", "scaler_unit", "threshold", "duration of"],
      "domain_tags": ["cosem_class", "register", "measurement_data"],
      "definition": "COSEM interface class for a measured value with scaler and unit.",
      "class_id": 3,
      "attributes": [
        {"attribute_id": 1, "name": "logical_name", "type": "octet-string[6]", "mandatory": true},
        {"attribute_id": 2, "name": "value", "type": "choice", "mandatory": true},
        {"attribute_id": 3, "name": "scaler_unit", "type": "scal_unit_type", "mandatory": true}
      ],
      "methods": [
        {"method_id": 1, "name": "reset", "parameter_type": "integer(0)", "meaning": "Reset register value when supported"}
      ],
      "common_instances": [
        {"name": "Time threshold for long power failure", "obis": "0-0:96.7.20.255"},
        {"name": "Threshold for long power failure", "obis": "0-0:94.55.60.255"}
      ]
    },
    {
      "id": "KB-L3-IC-4-EXTENDED-REGISTER",
      "type": "cosem_interface_class",
      "layer": "cosem_class",
      "name": "Extended Register",
      "aliases": ["COSEM Extended Register", "class 4", "CL 4"],
      "keywords": ["class 4", "cl 4", "extended register", "capture_time", "status"],
      "domain_tags": ["cosem_class", "register", "measurement_data"],
      "definition": "COSEM register with status and capture time in addition to value and scaler/unit.",
      "class_id": 4,
      "attributes": [
        {"attribute_id": 1, "name": "logical_name", "type": "octet-string[6]", "mandatory": true},
        {"attribute_id": 2, "name": "value", "type": "choice", "mandatory": true},
        {"attribute_id": 3, "name": "scaler_unit", "type": "scal_unit_type", "mandatory": true},
        {"attribute_id": 4, "name": "status", "type": "choice", "mandatory": true},
        {"attribute_id": 5, "name": "capture_time", "type": "date_time", "mandatory": true}
      ],
      "methods": [
        {"method_id": 1, "name": "reset", "parameter_type": "integer(0)"}
      ]
    },
    {
      "id": "KB-L3-IC-5-DEMAND-REGISTER",
      "type": "cosem_interface_class",
      "layer": "cosem_class",
      "name": "Demand Register",
      "aliases": ["COSEM Demand Register", "class 5", "CL 5"],
      "keywords": ["class 5", "cl 5", "demand register", "current_average_value", "last_average_value", "capture_time"],
      "domain_tags": ["cosem_class", "demand_register", "measurement_data"],
      "definition": "COSEM interface class for demand values based on averaging periods.",
      "class_id": 5,
      "attributes": [
        {"attribute_id": 1, "name": "logical_name", "type": "octet-string[6]", "mandatory": true},
        {"attribute_id": 2, "name": "current_average_value", "type": "choice", "mandatory": true},
        {"attribute_id": 3, "name": "last_average_value", "type": "choice", "mandatory": true},
        {"attribute_id": 4, "name": "scaler_unit", "type": "scal_unit_type", "mandatory": true},
        {"attribute_id": 5, "name": "status", "type": "choice", "mandatory": true},
        {"attribute_id": 6, "name": "capture_time", "type": "date_time", "mandatory": true},
        {"attribute_id": 7, "name": "start_time_current", "type": "date_time", "mandatory": true},
        {"attribute_id": 8, "name": "period", "type": "double-long-unsigned", "mandatory": true},
        {"attribute_id": 9, "name": "number_of_periods", "type": "long-unsigned", "mandatory": true}
      ],
      "methods": [
        {"method_id": 1, "name": "reset", "parameter_type": "integer(0)"}
      ]
    },
    {
      "id": "KB-L3-IC-6-REGISTER-ACTIVATION",
      "type": "cosem_interface_class",
      "layer": "cosem_class",
      "name": "Register Activation",
      "aliases": ["class 6", "CL 6"],
      "keywords": ["class 6", "cl 6", "register activation", "active_mask", "register_assignment"],
      "domain_tags": ["cosem_class", "billing_profile", "tariff_calendar"],
      "definition": "COSEM class used to define active register masks and register assignments.",
      "class_id": 6,
      "attributes": [
        {"attribute_id": 1, "name": "logical_name", "type": "octet-string[6]", "mandatory": true},
        {"attribute_id": 2, "name": "register_assignment", "type": "array", "mandatory": true},
        {"attribute_id": 3, "name": "mask_list", "type": "array", "mandatory": true},
        {"attribute_id": 4, "name": "active_mask", "type": "octet-string", "mandatory": true}
      ],
      "methods": [
        {"method_id": 1, "name": "add_register"},
        {"method_id": 2, "name": "add_mask"},
        {"method_id": 3, "name": "delete_mask"}
      ]
    },
    {
      "id": "KB-L3-IC-7-PROFILE-GENERIC",
      "type": "cosem_interface_class",
      "layer": "cosem_class",
      "name": "Profile Generic",
      "aliases": ["COSEM Profile Generic", "class 7", "CL 7"],
      "keywords": ["class 7", "cl 7", "profile generic", "capture_objects", "buffer", "capture_period", "profile_entries", "sort_method"],
      "domain_tags": ["cosem_class", "profile_generic", "measurement_data", "log"],
      "definition": "COSEM interface class for storing captured entries such as load profiles, billing profiles, event logs, and alarm/error logs.",
      "class_id": 7,
      "attributes": [
        {"attribute_id": 1, "name": "logical_name", "type": "octet-string[6]", "mandatory": true},
        {"attribute_id": 2, "name": "buffer", "type": "array", "mandatory": true},
        {"attribute_id": 3, "name": "capture_objects", "type": "array", "mandatory": true},
        {"attribute_id": 4, "name": "capture_period", "type": "double-long-unsigned", "mandatory": true},
        {"attribute_id": 5, "name": "sort_method", "type": "enum", "mandatory": true},
        {"attribute_id": 6, "name": "sort_object", "type": "capture_object_definition", "mandatory": true},
        {"attribute_id": 7, "name": "entries_in_use", "type": "double-long-unsigned", "mandatory": true},
        {"attribute_id": 8, "name": "profile_entries", "type": "double-long-unsigned", "mandatory": true}
      ],
      "methods": [
        {"method_id": 1, "name": "reset", "parameter_type": "integer(0)"},
        {"method_id": 2, "name": "capture", "parameter_type": "integer(0)"}
      ],
      "common_instances": [
        {"name": "Correct security operations event log", "obis": "0-0:99.98.11.255"},
        {"name": "Failed security operations event log", "obis": "0-0:99.98.12.255"}
      ]
    },
    {
      "id": "KB-L3-IC-8-CLOCK",
      "type": "cosem_interface_class",
      "layer": "cosem_class",
      "name": "Clock",
      "aliases": ["COSEM Clock", "class 8", "CL 8"],
      "keywords": ["class 8", "cl 8", "clock", "time_zone", "daylight_savings", "clock_base"],
      "domain_tags": ["cosem_class", "clock", "meter_function"],
      "definition": "COSEM interface class for date, time, timezone, daylight saving, and clock status.",
      "class_id": 8,
      "attributes": [
        {"attribute_id": 1, "name": "logical_name", "type": "octet-string[6]", "mandatory": true},
        {"attribute_id": 2, "name": "time", "type": "date_time", "mandatory": true},
        {"attribute_id": 3, "name": "time_zone", "type": "long", "mandatory": true},
        {"attribute_id": 4, "name": "status", "type": "unsigned", "mandatory": true},
        {"attribute_id": 5, "name": "daylight_savings_begin", "type": "date_time", "mandatory": true},
        {"attribute_id": 6, "name": "daylight_savings_end", "type": "date_time", "mandatory": true},
        {"attribute_id": 7, "name": "daylight_savings_deviation", "type": "integer", "mandatory": true},
        {"attribute_id": 8, "name": "daylight_savings_enabled", "type": "boolean", "mandatory": true},
        {"attribute_id": 9, "name": "clock_base", "type": "enum", "mandatory": true}
      ],
      "methods": [
        {"method_id": 1, "name": "adjust_to_quarter"},
        {"method_id": 2, "name": "adjust_to_measuring_period"},
        {"method_id": 3, "name": "adjust_to_minute"},
        {"method_id": 4, "name": "adjust_to_preset_time"},
        {"method_id": 5, "name": "preset_adjusting_time"},
        {"method_id": 6, "name": "shift_time"}
      ],
      "common_instances": [
        {"name": "Clock", "obis": "0-0:1.0.0.255"}
      ]
    },
    {
      "id": "KB-L3-IC-9-SCRIPT-TABLE",
      "type": "cosem_interface_class",